{
  "schema_version": 3,
  "dataset_id": "frontend-niche-skills-routing-v3",
  "catalog": {
    "excluded_skills": [
      "frontend-report-triage"
    ]
  },
  "clusters": [
    {
      "id": "semantics-forms-overlays",
      "description": "Native semantics, rendered accessibility state, form validity, and overlay lifecycle reports often share the same visible symptom.",
      "members": [
        "a11y-contract-testing",
        "semantic-markup-contracts",
        "constraint-validation-contracts",
        "js-form-validation-contracts",
        "overlay-focus-scroll-contracts",
        "css-transition-animation-contracts"
      ]
    },
    {
      "id": "navigation-render-lifecycle",
      "description": "Cold navigation, hydration, history restoration, document resume, and offline bytes must be separated by lifecycle boundary.",
      "members": [
        "browser-page-lifecycle-bfcache-contracts",
        "history-scroll-restoration-contracts",
        "deeplink-hydration",
        "ssr-hydration-mismatch",
        "pwa-offline-cache-contracts",
        "browser-storage-durability-contracts"
      ]
    },
    {
      "id": "async-state-transport",
      "description": "Raw effects, query caches, optimistic writes, and pushed transport updates all produce stale or out-of-order UI through different owners.",
      "members": [
        "async-effect-race-contracts",
        "frontend-data-fetching-cache-contracts",
        "optimistic-update-rollback-contracts",
        "realtime-transport-contracts"
      ]
    },
    {
      "id": "security-auth-host",
      "description": "Client security, server proxy, payment, authentication, iframe, WebView, and gesture capability reports have overlapping trust-boundary language.",
      "members": [
        "bff-proxy-security-contracts",
        "frontend-security-baseline",
        "payment-page-client-security",
        "frontend-auth-flow-contracts",
        "iframe-embed-contracts",
        "webview-bridge-pages",
        "user-activation-contracts"
      ]
    },
    {
      "id": "visual-performance-layout",
      "description": "Visual drift, page metrics, image selection, animation mechanisms, measurement loops, virtualization, and component reuse collide in UI review prompts.",
      "members": [
        "core-web-vitals-performance-contracts",
        "responsive-image-contracts",
        "design-to-code-fidelity",
        "view-transitions-contracts",
        "resize-observer-layout-contracts",
        "large-list-data-grid-contracts",
        "component-extraction-judgment"
      ]
    },
    {
      "id": "files-content-observability",
      "description": "Inbound files, outbound generated content, and captured error payloads all require direction and data-lifecycle evidence.",
      "members": [
        "file-ingest-contracts",
        "download-export-safety",
        "client-error-observability-contracts"
      ]
    },
    {
      "id": "language-values",
      "description": "CJK input, translated layout, timezone values, and decimal arithmetic can all appear as locale-dependent correctness bugs.",
      "members": [
        "cjk-text-and-input",
        "contenteditable-selection-contracts",
        "i18n-copy-and-layout",
        "datetime-correctness",
        "money-and-precision-contracts"
      ]
    },
    {
      "id": "pointer-media-devices",
      "description": "Pointer capture and media device ownership both involve browser-delivered input lifecycles and interruption cleanup.",
      "members": [
        "pointer-gesture-contracts",
        "media-capture-device-contracts"
      ]
    }
  ],
  "cases": [
    {
      "id": "a11y-contract-testing--representative",
      "kind": "representative",
      "difficulty": "smoke",
      "prompt": "Our modal has a visible title and selected tab, but Testing Library cannot find the dialog by name and the selected state disappears from the accessibility tree. Add regression coverage for the roles, accessible names, focus, and state.",
      "expected_skill": "a11y-contract-testing",
      "confusable_with": [],
      "rationale": "The request is explicitly about rendered accessibility semantics and role-based regression assertions."
    },
    {
      "id": "a11y-contract-testing--collision",
      "kind": "collision",
      "difficulty": "smoke",
      "prompt": "The checkout error summary is already built with native labels and inputs, but a refactor stopped announcing invalid fields and focus no longer moves to the summary. We need tests that catch the user-observable accessibility regression.",
      "expected_skill": "a11y-contract-testing",
      "confusable_with": [
        "semantic-markup-contracts"
      ],
      "rationale": "The native structure exists; the missing contract is observable role, announcement, and focus behavior rather than element selection."
    },
    {
      "id": "async-effect-race-contracts--representative",
      "kind": "representative",
      "difficulty": "smoke",
      "prompt": "A search component fetches directly inside an effect. Typing quickly lets the slow response for an older query overwrite the newest results, and navigating away sometimes logs a state update after unmount. Please lock down cancellation and take-latest behavior.",
      "expected_skill": "async-effect-race-contracts",
      "confusable_with": [],
      "rationale": "A raw effect owns request cancellation, stale response suppression, and teardown."
    },
    {
      "id": "async-effect-race-contracts--collision",
      "kind": "collision",
      "difficulty": "smoke",
      "prompt": "This screen does not use a query library: it calls fetch in an effect whenever accountId changes. The previous account can win the race and populate the new account view, even though the HTTP response itself is valid.",
      "expected_skill": "async-effect-race-contracts",
      "confusable_with": [
        "frontend-data-fetching-cache-contracts"
      ],
      "rationale": "The failure sits below any managed cache and belongs to effect ownership and request race handling."
    },
    {
      "id": "bff-proxy-security-contracts--representative",
      "kind": "representative",
      "difficulty": "smoke",
      "prompt": "Review a Next route handler that accepts a client supplied upstream URL, forwards most request headers, follows redirects, and streams multipart bodies without a size budget. We need a release gate for the server-side proxy boundary.",
      "expected_skill": "bff-proxy-security-contracts",
      "confusable_with": [],
      "rationale": "The repository-owned server relay creates SSRF, capability, redirect, header, and body-budget risks."
    },
    {
      "id": "bff-proxy-security-contracts--collision",
      "kind": "collision",
      "difficulty": "smoke",
      "prompt": "The browser calls our own catch-all API endpoint with a target host and method in query parameters. The concern is that the route handler can reach internal services and forward credentials, not that the page has an unsafe DOM sink.",
      "expected_skill": "bff-proxy-security-contracts",
      "confusable_with": [
        "frontend-security-baseline"
      ],
      "rationale": "This is a frontend-owned server gateway trust boundary, while the sibling is scoped to client-side traps."
    },
    {
      "id": "browser-page-lifecycle-bfcache-contracts--representative",
      "kind": "representative",
      "difficulty": "smoke",
      "prompt": "After leaving a dashboard and returning with the browser Back button, the old account data is visible and a second socket plus observer starts. A normal reload is fine. Diagnose page freeze and restore without forcing every pageshow to reload.",
      "expected_skill": "browser-page-lifecycle-bfcache-contracts",
      "confusable_with": [],
      "rationale": "The distinguishing evidence is restoration of a previously live top-level document from browser history."
    },
    {
      "id": "browser-page-lifecycle-bfcache-contracts--collision",
      "kind": "collision",
      "difficulty": "smoke",
      "prompt": "Back navigation restores the exact scroll offset correctly, but the page resumes with paused polling and duplicate analytics listeners. The bug only occurs when the browser revives the prior document; cold direct navigation is healthy.",
      "expected_skill": "browser-page-lifecycle-bfcache-contracts",
      "confusable_with": [
        "history-scroll-restoration-contracts"
      ],
      "rationale": "Scroll restoration is explicitly healthy; the broken boundary is document suspension and resume."
    },
    {
      "id": "cjk-text-and-input--representative",
      "kind": "representative",
      "difficulty": "smoke",
      "prompt": "A controlled Korean search field submits when the user presses Enter to confirm an IME candidate, producing duplicate searches with keyCode 229. The character counter also splits an emoji sequence incorrectly. Add composition-aware input tests.",
      "expected_skill": "cjk-text-and-input",
      "confusable_with": [],
      "rationale": "IME composition and grapheme-aware input are the primary failure mechanisms."
    },
    {
      "id": "cjk-text-and-input--collision",
      "kind": "collision",
      "difficulty": "smoke",
      "prompt": "Japanese translations fit the layout, but entering converted text into the controlled input loses the final composition segment and Enter fires the form too early. The issue reproduces only while the IME is composing.",
      "expected_skill": "cjk-text-and-input",
      "confusable_with": [
        "i18n-copy-and-layout"
      ],
      "rationale": "This is input-method event sequencing, not translated-copy length, pluralization, or locale formatting."
    },
    {
      "id": "client-error-observability-contracts--representative",
      "kind": "representative",
      "difficulty": "smoke",